batch index,sentence NUCLE ID,original_text,is perfect,original_language79,144934,This involvement has freed people from demanding and repetitive jobs and at the same time increased the efficiency of production.,True,english
79,94669,"However, it can be argued that after all it is the children's responsibility to take care of their parents.",True,english
79,111328,No Excess Mortality Risk Found in Counties with Nuclear Facilities.,True,english
79,24321,They will not be able to afford the high medical costs and thus are unable to get proper treatment for their illness.,True,english
79,17901,"On the contrary, this is a minor issue as only those with access to hospital's database can interpret the information.",True,english
79,89175,"Wikipedia stated that "" As of July 2007, medical costs for a typical inmate in the USA might run an agency around US $33 per day, while costs for an ageing inmate could run upwards of US $100.",True,english
79,112441,User's expressions and desires are somewhat restricted by the buttons on the controller.,True,english
80,70350,"But other than the features that the "" MEMSwear "" has, this product has additional functions (Khandani, S. (2005)).",True,english
80,112920,"The original lead-bismuth proposed for use in the (LFR) will also be replaced by lead, further decreasing the cost of the coolant by 10 times (Tucek, 2005).",True,english
80,17022,Arguments presented for the ban on the use of surveillance technology to track individuals are totally flawed.,True,english
80,139406,We have known the theory and been aware of the process.,True,english
80,18253,In : Genetic Counselling and Genetic Testing : Hereditary Cancer Syndromes.,True,english
80,48949,"More importantly there are opportunities for infertile couples to have children, which in the long term might be the most effective way.",True,english
80,86007,"Besides these two factors, government regulation also contributes to shaping this technology.",True,english
80,6018,"These innovations are usually backed by solid technological background, expertise and sufficient funds.",True,english
80,49301,"As a result, people's lifespan also increases.",True,english
80,82668,"The latter BlackBerry smartphones were equipped with fully-support QWERTY keyboard, a preferable feature by BlackBerry users.",True,english
80,111571,"For instance, the telegraphers ignored warnings from other ships about the icebergs ahead.",True,english
80,157668,It indeed has brought great convenience and efficiency in attending to the needs of patients.,True,english
80,52843,"In conclusion, aging is nowadays a global issue.",True,english
80,148134,"However, family members who are unaffected by the genetic disease may feel guilty and this condition is known as survivor guilt.",True,english
81,12924,It is now widespread and ranging from testing the congenital defect of a foetus to finding the existence of the oncogene.,True,english
81,4857,"From the same article which was mentioned in the first paragraph, a surprising fact emerges from the sophisticated Internet.",True,english
81,67884,What exactly is this new type of transportation ?,True,english
81,139633,"However, one concern would be that Helium is a natural occurring element with limited quantity that would soon deplete pushing price higher (James, 1996).",True,english
81,1389,"To conclude, both skunkworks and conventionally generated technologies are undertaken by a group of professionals who are given adequate funds and resources.",True,english
81,129095,"In this context, VHTR is much cheaper than coal-fuelled plants.",True,english
81,129065,"The helium coolant was cut off from the system and the reactor was able to shut down automatically without leakage of any radioactive particles (Hecht, 2008).",True,english
81,124181,"Some people argue that these defects caused the Chernobyl accident, psychology can not solve them.",True,english
81,139605,There is a need for our world to move towards nuclear energy due to three reasons.,True,english
81,144110,"Furthermore, working longer keeps one's mind constantly generating thoughts and ideas.",True,english
81,127573,"However, the shift from fossil fuels to nuclear power is inevitable.",True,english
81,25434,Singapore is different from the welfare states in Europe such as Germany and Denmark.,True,english
81,91991,"However, the aim of government is to enable people in its country to live better and happier.",True,english
81,128887,We will discuss two out of the six new nuclear technologies---Very High Temperature Reactor (VHTR) and Sodium Cooled Fast Reactor (SFR).,True,english
81,4918,"However, at this stage, they must face a serious question : "" Where do the investments come from ?",True,english
82,142164,"In conclusion, arguments about insufficient materials, dangerous operation and not beneficial in building VHTR are not affirmed.",True,english
82,63826,Several methods of implementation as well as distinct activities that occur during implementation must be considered when testing is done.,True,english
82,141779,"In fact coal combustion produces carbon dioxide and other greenhouse and also sulphur oxides and nitrogen oxides, which are harmful to human health, are responsible for acid rain.",True,english
82,134272,""" (Dick, 1986) Thiokol engineers found that the temperature was colder than 53  F (12  C) and they did not have enough data and experience to determine if the O-rings would work properly to seal joint.",True,english
82,82632,"Therefore, the emphasized function of the smartphones at that time was to receive and send emails.",True,english
82,109149,"Therefore, in my opinion, the Very-High-Temperature Reactor should be given priority for further research and development funding.",True,english
82,6740,The birth of the laptop computer at Toshiba.,True,english
82,134332,Nuclear power is any nuclear technology designed to extract usable energy from atomic nuclei via controlled nuclear reactions.,True,english
82,113770,""" CITATION Ver09 \ l 2052 (Very-High-Temperature Reactor (VHTR)) The pebble-bed and prismatic design of VHTR makes no intermediate refueling necessary.",True,english
82,119437,"Therefore, support should be given to develop nuclear power.",True,english
82,134349,"Sweden is even committed by law to phase out its existing nuclear power plants (Fred Guterl, 2002).",True,english
82,87669,Bill Gates' way of running the business is largely monopolistic.,True,english
82,26094,The old age dependency ratio will increase from one elder adult relying on 10 working adults in 2000 to 3 working adults in 2030.,True,english
83,120950,"Hence, their availability to build up is limited.",True,english
83,18009,"This is because, the Insurance and Financial Services Association (IFSA) in Australia have a policy that states, genetic testing or having family members at risk for certain disease, will not be required for assessment in the insurance companies (Centre for Genetic Education, n.d.).",True,english
83,76913,"Apart from the major social issue, there were several other factors including economical problem and technical problem, which also contributed to the final prototype of the mass production on the assembly line.",True,english
83,2801,The phenomenon of corruption is very common as well.,True,english
83,33486,"Good health and material needs being granted, the elderly population would be expected to be capable of being responsible for their own financial needs.",True,english
83,37168,"Nontheless, some people are concerned about the government's spending on providing various subsidies for the elderly.",True,english
83,31248,"Therefore, solutions that will help to ease the aging process are much needed.",True,english
83,104341,A major constraint of nuclear power is the tricky issue of waste disposal.,True,english
83,60558,"Last but not least, reducing public spending on the aged helps to stress filial obligation.",True,english
83,152496,"Therefore, personally viewing of the results of genetic testing will cause a lot of problems to society.",True,english
83,125533,"First, there are myriad benefits of nuclear power that the critics often overlook.",True,english
83,141098,"Sometimes it is impossible to prevent problem occurring, but we can still solve the problem.",True,english
83,68451,"Firstly, "" Penicillin is one of the earliest discovered and widely used antibiotic agents, derived from the Penicillium mold.",True,english
83,148644,Should a carrier of a known genetic risk be obligated to tell 3rd parties ?,True,english
83,135804,"Chernobyl, the accident scenario and its global impact.",True,english
84,49617,Spending of public funds should be diverted to various areas of the country depending on its country focus.,True,english
84,147241,"Other than that, some people claim that a genetic disease patient will be discriminated from employment once his or her genetic information is spread by family members.",True,english
84,158582,"Therefore, the data acquired from individuals with RFID will be safely kept to ensure the privacy of the individual.",True,english
84,40603,Japan and Europe are two examples that have done well in tackling this issue.,True,english
84,99925,Healthcare has become more of a want rather than a basic need.,True,english
84,135572,They should be given the required knowledge and should also be warned about the worst thing that may happen if they make even a simple mistake.,True,english
84,65531,"In spite of these differences, these two kinds of technology share several important similarities.",True,english
84,93896,"Such an act equates to deserting the aged, leaving them to support themselves.",True,english
84,83293,"During the process, they must know how to design.",True,english
84,86071,They lack the motivation to create new things.,True,english
84,24246,Palliative care is now getting the recognition it deserves together with professional training and more funding.,True,english
84,148535,"Opponents of this position argue that the family members may hastily undergo a genetic test on receiving the negative news without careful consideration of the possible discrimination that they may face after the genetic test (Agatha M et al., 2009).",True,english
84,155069,"RFID-tagging in certain commercial products has been widely practiced in the retail stores in the United States, namely Wal-Mart, for the purpose of convenient inventory tracking.",True,english
84,103211,"After various considerations, this writer concludes that only one factor can not be blamed as the sole cause of the accident.",True,english
85,24317,Better medical facilities allow people to live longer but at the same time increase their cost of living as well.,True,english
85,89283,"Thus, public spending on the aged should be diverted to other more important aspects.",True,english
85,15376,"In February 2005, when the State Department (US) asked for public comment on the implementation of Radio-Frequency Identification (RFID) in passport booklets, of the 2,335 comments received, 98.5 percent were negative, with 86 percent expressing security or privacy concerns, the department reported in an October 2005 notice in the Federal Register (Lewan, 2009).",True,english
85,150846,Family members have to know the result so that they can receive early treatment and have early financial and psychological preparation.,True,english
85,5537,"As science and technology develops faster and faster nowadays, more and more machines and instruments are created.",True,english
85,90714,This might in turn lead to a series of negative chain effects such as making education less affordable.,True,english
85,116074,Nuclear power for sustainable development : Current status and future prospects.,True,english
85,142231,"It takes 20 seconds for a full insertion and this is too slow to prevent the core from running away when the reaction is under the unstable mode (Frot, 2001).",True,english
85,140991,"This is a unique advantage of MSRs compared to traditional solid-fuel reactors (Charles W. Forsberg, 2007).",True,english
85,116426,"Secondly, the ineffective communication and misunderstanding between departments, between sponsors and contractors also lead to engineering accidents.",True,english
85,50648,A world-class city also means that the nation should be safe and secure.,True,english
85,139116,Feynman's Appendix to the Rogers Commission Report on the Space Shuttle Challenger Accident.,True,english
85,92496,"If we do not address this issue and even set curfew to it, there might be more worrying problems arising which eventually leading to bigger problems and more difficult to solve.",True,english
85,59423,"For a country to do well, the government has to ensure that all areas of its development are well funded.",True,english
86,136252,"As a result, the percentage of plutonium in the waste is reduced effectively.",True,english
86,112673,Commemoration of the Chernobyl Disaster : The Human Experience Twenty Years Later.,True,english
86,142984,The technology so far is not able to prevent corrosion of nuclear metallic materials.,True,english
86,156346,"Such chips are useful, cheap to implement and reduce the risk of losing items which lead to capital loss.",True,english
86,25003,They should be encouraged or compelled by law to save and invest more of their income earned while they are active in the work force.,True,english
86,153370,"Finally, it has not been determined whether RFID tags might affect the efficacy of pharmaceuticals.",True,english
86,43187,"This could be achieved through informal and familial channels (Peterson, 2001).",True,english
86,97983,"Thus, it will be a big problem for the elderly with memory loss to remember the instructions of each pill.",True,english
86,137645,"In conclusion, nuclear power is definitely one of the better choices when we are looking for a green source of energy.",True,english
86,143873,"After all, these children will eventually be part of the elderly population.",True,english
86,102157,"Moreover, both the structure and the size of the reactor had certain deviations from the norm.",True,english
86,101371,""" Some Important Facts About Nuclear Power.",True,english
86,31667,Preparing for an aging population : The Singapore Experience.,True,english
87,99387,"With better knowledge in Architecture, homes and places outside home are made user-friendly for the elderly",True,english
87,6427,"Khandani in his article mentioned four sub categories in the take off which are namely prototyping, concurrent engineering, documentation and applying for patents.",True,english
87,133851,"With strong performance in the SCWR concept, mankind would experience better protection with the construction of new nuclear plants.",True,english
87,33235,This means that the elderly can continue to stay in their flat without having to move out.,True,english
87,64974,"Technology, no matter how it is developed, will be used to address problems that people face.",True,english
87,135196,"Hence, it will be reasonable and wise to support the research.",True,english
87,150227,"For example, a parent might not want to tell their children that she has a certain inherited disease as she is guilty about passing the mutated genes to her children.",True,english
87,83694,The other point is that the credit card saves a lot of manpower and material resources.,True,english
87,153716,Surveillance technology should be used in a correct way to improve human's life and not to lead to dehumanization.,True,english
87,73293,A good design will be able to fit ninety percent of its users.,True,english
88,14305,"Nevertheless, it has the ability to track criminals, improve the efficiency of our healthcare system, as well as to expedite the cracking of criminal cases.",True,english
88,78613,But the fact is that the lack of researchers has become the'bottleneck' restrictions for most of the companies in China.,True,english
88,97829,"In return, the government should take care of our elders as a means of gratification.",True,english
88,141225,"As for the materials, scientists have already found Oxide Dispersion Strengthened (ODS) alloys and fibre reinforced ceramic, which are very hard and corrosion resistant materials.",True,english
88,138499,"As a result, it will decrease the quantity demanded by potential consumers and manufactures may not find it profitable to mass produce it.",True,english
88,114411,"Furthermore, it can also be used to deliver ten times the energy of an original fuel.",True,english
88,40426,""" Population aging is likely to become a dominant feature of social change around the world.",True,english
88,98329,This can be further illustrated by a research conducted by Hunter Centre for Health Advancement in Whales.,True,english
88,136413,"None of the SFRs constructed to date have been economical to build or operate (Lineberry, et al).",True,english
88,74157,The driving force becomes the desperate need for solving a problem.,True,english
88,66333,"When I went to high school, luckily we had three organizations : the Youth Union, Harmonica club and PTNK Soccer league.",True,english
88,89514,"Thirdly, the modern state of technology has significantly eased the process of aging.",True,english
88,141460,It uses high core outlet temperatures that enable hydrogen and electricity production.,True,english
88,19095,"In Singapore, $4 billion was committed over 5 years to expand the healthcare infrastructure which includes redevelopment of older hospitals and also building of 2 new hospitals.",True,english
88,112284,"To point out a few of them, the claimed benefits include minimised nuclear waste and improved safety.",True,english
89,46406,"Therefore, public spending on the aged should be limited so that economic growth can be sustained, societal problems faced by the communities can be solved and other essential policies can be sustained.",True,english
89,82653,"On the contrary, BlackBerry users were into the phone for its outstanding support for working environment together with acceptable features for relaxation.",True,english
89,26958,"For example, in Europe, 2it is estimated that a quarter of her inhabitants will be non-European in origin, character and beliefs, if she continues to depend on importing immigrants to ease her ageing problems.",True,english
89,114526,The total cost is a very huge figure as compared to other types of power plants.,True,english
89,157985,"The few examples of surveillance technology are digital video recorders, hidden spy cameras and RFID.",True,english
89,154294,Critics have long been condemning the use of surveillance technology on humans.,True,english
89,43423,""" (Executive summary, Committee on Ageing Issues : Report on the Ageing Population) Thus, an outcry of more spending on the aged is rising in Singapore.",True,english
89,130639,"To address this situation, a variety of Generation IV nuclear reactors is developed.",True,english
89,118957,"As time passes, the government is likely bound to increase fuel price, making fuel cars an unworthy choice.",True,english
89,87314,This would affect the testing and implementation of the solution during the process.,True,english
89,140604,This cycle bypasses the stage where Plutonium-239 is produced.,True,english
89,78605,Less money leads to higher risk of failure.,True,english
89,123554,"Although the VHTR is promising, critics argue that it is not worth further research due to lack of suitable materials, potential safety hazard and high cost of construction.",True,english
89,109453,"Although the cost for building Generation IV reactors is very high, the issue of the increase in demand of energy today needs to be addressed.",True,english
89,109233,"In contrast, the SFR does not have this safety concern for its operating temperature is just half of that of the VHTR.",True,english
90,11650,"Security cameras and closed circuit televisions (CCTV) are being installed everywhere, from homes to offices, shopping malls and even in schools.",True,english
90,15226,"Topic2 : "" The individual requesting genetic testing should have the final say in whether to reveal the results of such testing.",True,english
90,139155,The general public will only approve of a power source if it is cost-effective.,True,english
90,116630,"Among the six reactors, the Very-high-temperature reactor (VHTR) stands out and may probably be the first choice as future fuel although some people may worry about its safety and cost.",True,english
90,150350,"Moreover, some people tend to worry too much about their genetic disorder and this may ultimately lead to depression.",True,english
90,33352,"All in all, Singapore has been largely successful in accommodating the rising proportion of elderly in its society.",True,english
90,158564,"In this way, such technology like RFID can be used to keep public safety.",True,english
90,125928,"Safety is one of the biggest concerns when it comes to nuclear powered reactors, because the result is grievous and devastating if a nuclear reactor accident were to happen.",True,english
90,137449,"In addition, the coolant used in VHTR is helium.",True,english
90,141969,"In the future, nuclear power would be an important power resource in the world.",True,english
90,155109,We should seek credible solutions for issues which arise instead of prohibiting an intelligent invention of mankind.,True,english
90,14697,"According to the research, for a person tests positive for a gene mutation (a change in a person's genes), their children, siblings, and parents automatically have a 50% chance of having the same mutation (Cancer.Net, 2009).",True,english
90,118917,"One suggestion is to design better, stronger and safer materials for the frame of the electric car.",True,english
91,128112,Retrieved June 29 2009 from lisme.org/etp/Hs% 20 Engineering% 20 Engineering pdf.,True,english
91,138375,Security has always been the most concerned problem which is also biggest trouble in using nuclear power.,True,english
91,29974,"Nevertheless, no matter how refined the education system is, it could never instil moral values in children which are critical in tackling the ageing problem.",True,english
91,72759,A lot of findings showed that people tend to imitate the language and behavior which are inappropriate in society.,True,english
91,117767,"However, due to the plant simplification, its design is far simpler, that is, without the circulation pumps, pressurizers, steam generators and dryers.",True,english
91,27098,"This can be done by organizing campaigns, and through media such as advertisements and short documentaries.",True,english
91,46902,"Hence, by preparing and nurturing the leaders of tomorrow from young, they will be able to lead the country to a whole new level.",True,english
91,49747,"As a result, despite the limit on money spending, we still respect traditional responsibilities.",True,english
91,149303,"This psycho-emotional consequence can trigger more harm than good to the individual as well as the family relationship as people may feel depressed, guilty or confused following the disclosure of the result.",True,english
91,139965,"Two years ago on 1st August, 2007, an accident that shocked the world happened.",True,english
91,147391,Norrgard (2008) also mentions that the decision to undergo genetic testing is a very personal matter.,True,english
91,110354,"Also, accident prevention system coverage was not extensive.",True,english
91,48099,These have helped to increase the employability rate for elder workers.,True,english
91,138940,"The previous accidents in 1979, 1985 and 1988 were caused by spring floods that overwhelmed the dam's capacity.",True,english
92,111620,"When we set wrong priorities, we head in the wrong direction despite having the best technology available.",True,english
92,123410,Other favoured energy sources like solar panels and wind turbines are strongly encouraged by some.,True,english
92,142688,"Among all these reactors, the concept of supercritical-water-cooled reactors (SCWR) is the most suitable concept for funding and development.",True,english
92,64174,"In conclusion, engineering design process helps to meet human needs by the identification and the analysis of the processes.",True,english
92,87624,Kuwait's biggest field starts to run out of oil.,True,english
92,70119,Energies such as solar energy have been promoted to fulfill this purpose.,True,english
92,75212,"Nowadays, technology and science in China is growing rapidly.",True,english
92,155187,"Secondly, surveillance technology breaks social relationship and family bonds due to the loss of trust.",True,english
92,150179,U.S Department of Energy Office of Science.,True,english
92,154631,"Jim.2009 August 20.Surveillance Technologies.Technology Education.Retrived October 4,2009, from www.technology-and- edu.blogspot.com/2009/08/surveillance-technologies.html",True,english
92,17243,"If they decide to keep mute about it, it may cause harm to others.",True,english
92,86834,This actually spurred the manufacturers to improve the technology of conversion from gasoline vehicle to dual-fuel vehicle so that the cost can be reduced and more car owners could benefit from the CNG technology.,True,english
93,134338,"The nuclear power plant provided about 14 percent of the world's electricity production in 2008 "".",True,english
93,132018,"Besides the wide range, in extreme conditions, the operating temperature can reach 840  C (Idaho National Laboratory, 2007).",True,english
93,150621,Disorders like haemophilia and Huntington's disease are dangerous if attention is not paid to them.,True,english
