batch index,sentence NUCLE ID,original_text,is perfect,original_language
1,151075,"Thus, genetic testing can be beneficial to affected patients and their relatives.",True,english
1,110520,"Most engineers only care about how to apply technology into practice, but they seldom care about how to make products that can be used easily.",True,english
1,50957,This leads to a sudden need of facilities and technologies to cater for this particular group.,True,english
1,150968,"By not informing about the risks his or her relative may face, the tendency of the carrier to shift from beneficence to paternalism has in fact taken away the ability of the relative to choose for herself (Kultgen, 1995).",True,english
1,25850,This allows money to be spent on more pertinent sectors such as education which has been a traditional source of growth for Singapore.,True,english
1,141657,"According to Butler (2004), it costs about US $1 billion dollars to build a nuclear reactor.",True,english
1,17684,"In this case, victims may lose their privacy even without awareness.",True,english
1,64921,The final process is to test and implement the solution.,True,english
1,41150,"Due to the need of raising taxes to provide for the elderly, local consumptions of goods may reduce significantly and foreign investors will consider relocating their investments.",True,english
1,152159,The situation of discrimination is subjective and does not amount to a general trend in family relationships.,True,english
1,113616,"In my opinion, I trust that the use of psychology during the design process would have prevented the accident.",True,english
1,33824,A nation's economy is the main source of country's income as it is an indicator of a country's wealth.,True,english
2,15649,Most companies are not willing to employ them as they may be seen to be inefficient because of their disabilities.,True,english
2,25623,"Singapore being a resource scarce country, the only resource we can make use of is our people.",True,english
2,47059,""" In Singapore, factors such as a relatively low birth rate and high-quality health care, which helps people live longer, contribute to the ageing population.",True,english
2,147358,"Henry, T. & Greely, J.D, (2005, September 1).",True,english
2,148776,"However, the controversy is that if the individual who carries a genetic risk should tell their relatives the results of genetic testing.",True,english
2,89353,"By providing good education and good jobs, our life will be guaranteed until our old age.",True,english
2,136390,"Also, it might be very difficult to safely recover the waste once it has been placed in the seabed.",True,english
2,139715,"For quite some time now, there has been concern among the pubic over the safe operation of nuclear reactors.",True,english
2,118517,"After all, electricity is also a perfect energy which has no side-effect on the environment.",True,english
2,112956,"5 Hejzlar, P. et al (2009) Cross-comparison of fast reactor concepts with various coolants.",True,english
2,138673,"Therefore, these will lead to the high energy outputs which can cater for an increasing demand on the electricity consumption.",True,english
2,140865,"The Chernobyl was an accident waiting to happen, the early model of the Soviet reactor which had no containment vessels were no longer operating.",True,english
2,41437,"Firstly, the national budget will come under pressure.",True,english
2,94339,Research and development has created many convenient and simpler methodologies to help ease the aging process.,True,english
2,132719,"Hence, nuclear power has the advantage in terms of higher output and consistent energy production as it runs 90 per cent of the time (Kurt, 24 September 2008).",True,english
3,141289,It is evident that psychology is able to reduce and also prevent errors by applying to both the micro and macro aspects of design processes of a system.,True,english
3,148585,This is because there are many social and emotional aspects with regards to genetic testing.,True,english
3,62224,"However, these are just extra solutions to help the elderly and bring more convenience to families who can afford them.",True,english
3,149080,Process and outcome in communication of genetic information within families : A systematic review.,True,english
3,117875,"If we are not able to handle the wastes well, the nuclear pollution will trigger the catastrophe.",True,english
3,89287,"For example, people say that old single women, whose incomes are mainly not high, are vulnerable and need special care.",True,english
3,4736,"With few responses from local consumers, it is really tough for the innovation of engineering design in China.",True,english
3,66495,"For example, a lot of stress tests had to be done during the process of making NEWater (2008).",True,english
3,101874,"For example, SCWR is a high efficient nuclear generator that will save a lot of cost when the maintenance is well-practiced.",True,english
3,9959,The popularity of Usenet was due to the fact that it was inexpensive and provided semi-anonymous communication through which people could share their ideas.,True,english
3,64105,"Sadly, my home country, Malaysia, is not a very good example to be followed by others.",True,english
3,55809,"If the government finds that aging is a heavy burden, it is bound to decrease the necessary public expenditure, thereby forcing more people to use private health institutions.",True,english
3,94581,"To do this, we should know what "" health "" means for an aging population.",True,english
3,80023,"Yogendran, S. (2002) GPS-The different arguments.. ?",True,english
3,119384,"However, it has also been proven that reprocessing nuclear waste cuts down greatly on the radioactive life of the waste.",True,english
4,12880,"As mentioned by the "" American Medical Association "" (Roberti 2007), RFID allows quick and accurate identification and access to patients' data in times of emergency.",True,english
4,102826,"However, there are only 441 nuclear plants in the world today (Butler, 2004).",True,english
4,148635,"Some may feel that the individuals are likely to be a burden to them and may start to shun or keep away from them, causing them to feel even more upset or depressed.",True,english
4,109946,Researches from the nuclear and chemical industry show that 20% to 50% of accidents and failures involve errors in design.,True,english
4,86219,""" This is a famous quote by James A. Michener.",True,english
4,153570,"Furthermore, there is no need for the tags to be scanned to retrieve the information (Syed & Mohammad, 2008).",True,english
4,108842,"Revival of nuclear reactor, molten salt reactor",True,english
4,139733,Another fascinating fact is that the VHTR's waste goes back to its repository and that it can produce hydrogen from water due to its high working temperature.,True,english
4,115458,"As described, the inputs of applied psychology can also be provided through the different organizational levels in a design team.",True,english
4,156850,Consumers are at the greatest disadvantage when it comes to RFID technology because hidden placement of tags by companies allows information to be retrieved from consumers.,True,english
4,115341,The radioactive effects of the aftermath can still be felt even years after the accident with common side effects that include deformities in newborn babies.,True,english
4,73275,"However, the functionality will determine the ultimate success of the product.",True,english
4,124028,Opponents may insist that it is very expensive to build and operate nuclear reactors.,True,english
4,126982,Traditional surgeons used to spend long hours operating without changing their hand postures.,True,english
5,51256,"Thus, we have to analyze and understand the problems that have been forgotten or overlooked by the developed country.",True,english
5,123586,"According to McCarthy (2009), the VHTR is quite safe due to its special design which is different from reactors of the Chernobyl type.",True,english
5,63117,"In developed countries, problems of aging populations are surfacing and at the same time worsening.",True,english
5,29009,Healthcare cost in Singapore is constantly rising with the advance in technology.,True,english
5,58317,Policies that encourage skills upgrading have also been introduced to enable the aged to re-enter the workforce.,True,english
5,44724,The check up could only allow you to have early detection of your illness.,True,english
5,23305,"However in recent times, such stereotypes have been shelved away as the younger generations learn to embrace the wealth of experience the elderly share, thus increasing the likelihood for elder employment.",True,english
5,93181,"One machine, being tested in Germany, sprays a burn patient's own cells onto a burn, signaling the skin to re-grow "".",True,english
5,152018,"In my opinion, I believe that individuals should be obligated to reveal such information to their relatives.",True,english
5,141017,Thorium is three times more abundant in nature compared to uranium and occurs mainly as'fertile'.,True,english
5,96851,The quick dial function allows the elderly to seek emergency or medical help promptly with just a press of a button.,True,english
5,69383,Conventionally generated technology versus innovation created in a skunk works,True,english
5,141454,"The public's main concerns of nuclear reactors are the high cost of nuclear plants and nuclear research, the hazard that it poses and whether the nuclear reactors are really efficient enough to replace coal and gases.",True,english
6,6159,"Identify and Establish the Need, Develop a Problem Statement",True,english
6,157901,"Secondly, tracking people may result in privacy crisis, which can cause more serious problems.",True,english
6,118620,"For example, the explosion of reactor 4 in the Chernobyl power plant resulted in 237 deaths due to radiation.",True,english
6,10158,"Once the needs are identified, ideas have to be developed through research.",True,english
6,23481,This is one of many ways to ensure that Singapore citizens will live a better life when they get older.,True,english
6,29914,"According to the Ministry of Manpower, such jobs are usually occupied by people aged 65 and above and there is still a prevailing shortage of manpower.",True,english
6,29860,This is to ensure that the future batch of elderly are well-prepared for their own ageing process and not just wait for the government to take care of them.,True,english
6,134305,"In the case of the Challenger accident, lack of psychology education was indeed the main cause.",True,english
6,137306,"According to World Nuclear Association (WNA), the current energy mainly comes from oil and gas.",True,english
6,47269,"After all our education, can we really call ourselves a civilized nation if we close our eyes to the suffering of the elderly living with us ?",True,english
6,13688,There could be abuse of the system as it could lead to information falling into the wrong hands.,True,english
6,30121,It should be at the maximum limit where the government can still withstand so as to help as many elderly as possible.,True,english
6,38544,"In this context, current development has gradually helped to ease the aging process.",True,english
7,46480,"Despite adopting the Central Provident Fund system, statistics has proven that only one in three Singaporeans are financially prepared.",True,english
7,44046,"By limiting the money being spent on the aged, the government could help a very important sector in the MCYS.",True,english
7,122623,"Thus, it is essential to do research on VHTR and it will deserve the effort and the funds we spend in the future.",True,english
7,17270,Try to talk to someone close to you.,True,english
7,143221,"The technical features of LFR which offer a possibility for procuring "" sustainability, safety and reliability, and economic goals are the use of Lead coolant and a long life "" (INL, 2007).",True,english
7,97948,She can easily call her family and check voicemail by herself.,True,english
7,144000,"By adopting the use of means testing, it allows lower income patients to enjoy more subsidies than higher-income patients (Ministry of Health, 2009).",True,english
7,111561,"While it is true that we can not control the climate to suit our needs, we can always suit the environment by taking a proactive stance in contingency planning.",True,english
7,51062,"Thus, it is important to keep improving our current research on technological inventions and government policies on architecture that have helped to ease the ageing process, as the benefits are definitely worth the cost.",True,english
7,83239,"With an aging population, it means that older citizens form a relatively huge percentage of the total population in Singapore thus it also applies to the consumer market.",True,english
7,11015,"For example, Lockheed's P-80 Shooting Star fighter jet, which was designed and built under the knowledge of only the researchers and the United States military, helped the US overcome the technology gap which Germany had over it during World War 2.",True,english
7,147529,"For example, if the genetic disease is related to X-linked genes, only males are affected while females remain as carriers of the disease, unless it concerns the autosomal recessive genes (wrongdiagnosis.com, n.d.).",True,english
7,18914,Council Recommendation on the limitation of exposure of the general public to electromagnetic fields (0 Hz to 300 GHz).,True,english
8,149696,"Varga, E. (2008, November 07) Family Testing for Clotting Disorders.",True,english
8,141458,"As cited from Idaho National Laboratory (2009), the Very-High-Temperature Reactor or "" VHTR "" is a helium-cooled reactor which is graphite-moderated, with a one time uranium fuel cycle.",True,english
8,74737,"As the example given by Khandani's article, Wright brothers are actually gone through this five-step process, to show that design problem may require backtracking and iteration.",True,english
8,146595,"Therefore, the carrier should not feel obliged to reveal his disorder.",True,english
8,75388,"If this happens, we may not even have sufficient rice for survival.",True,english
8,29953,"Indeed, this concept is applicable to a real life context in our society - the old versus the young workers.",True,english
8,146504,"Consequently, a disadvantageous situation is created instead of a beneficial one.",True,english
8,16334,"By using this technology, the location of the patient can be easily detect by a reader and immediate action can be taken if the patient is in risk.",True,english
8,76996,This is because the products are still usable despite some minor wear and tear.,True,english
8,48996,The retirement age of Singapore is currently 62.,True,english
8,111796,"Though the passive safety features will take over,the plant will be non operational.",True,english
8,91480,IT makes it easier to grow old nowadays with more available help.,True,english
8,70242,"Therefore, water is also one essential need for people to survive.",True,english
8,86252,"They lack of analytical skills, creativity and innovation.",True,english
9,46644,"If public spending is limited, the pressure on the government will be reduced.",True,english
9,106757,Gcse science physics high school electricity - power stations nuclear power advantages.,True,english
9,120706,"The development of the VHTR system will not only benefit the fuel industry, resolve the energy crisis, but also encourage the development of new heat-resistant materials and temperature controlling techniques.",True,english
9,137683,The discussion of the generation IV reactor,True,english
9,152503,"Hence, the individual requesting genetic testing should not have the final say in whether to reveal the results of such testing.",True,english
9,114121,One such alternative would be nuclear energy.,True,english
9,115456,The use of psychology as described by Wilpert (2008) in preventing the errors in design by the designers who are also only human involves the introduction of applied psychology as a method of curbing the potentially negative effects that may arise from the dynamics of individual and group psychology in design teams.,True,english
9,136394,SFR is designed for management of high-level wastes.,True,english
9,29631,Our government needs to be pragmatic in its allocation of financial resources.,True,english
9,76875,"In contrast, if there is no competition within each other.",True,english
9,140048,"Therefore, whether or not there is the use of psychology during the design process, it is inevitable that engineers make mistakes.",True,english
9,95242,"As a result, the elderly would be able to receive immediate help and treatment.",True,english
9,140713,"This means that if the temperature of the day is higher than usual, the performance of the nuclear reactor will drop.",True,english
9,110313,The result was a contaminated food cycle and acute cancer-related illnesses.,True,english
9,33003,"Not only that, an educated population will also mean a more productive workforce for the country, which will allow them to have an edge over others.",True,english
10,8182,"Besides government influence, the survival of a new technology also depends on social acceptance of the new product.",True,english
10,136370,Safety is another major concern about nuclear power.,True,english
10,47198,limited resource and additional financial cost) in employing older workers.,True,english
10,119221,Other factors should be included for a more objective estimation.,True,english
10,106986,"Moreover, the VHTR adopts a closed cycle to ensure thorough burning of transuranics.",True,english
10,129040,"This brings up the efficiency of the reactor by as much as 50 percent (Hecht, 2008).",True,english
10,120818,The six Generation IV Reactor are revolutionary designs of nuclear reactors.,True,english
10,97635,"In 2006, the Chinese Government granted over 500 billion RMB of pension to 460 billion pensioners nationwide, and the medical expenses of these people were more than 3 times that of the young population.",True,english
10,70800,"Power stations, also known as power plants, are common sources of energy in most countries and they make use of the combustion of fuels to produce energy in powering up the whole city.",True,english
10,41167,This will then become a snowballing effect causing further improvements in the economy.,True,english
10,156572,"On the other hand, tracking devices such as the use of Ground Positioning System (GPS) have recently been more widely available.",True,english
10,89592,"Similarly, the government has to provide elderly benefits as most of the elderly are no longer in the workforce and thus have no regular income.",True,english
10,145024,American Recovery and Reinvestment Act of 2009.,True,english
11,141541,"Today's technology is focused on developing'robot-assisted-surgery' but, gradually, robots are becoming more sophisticated and diverse.",True,english
11,67251,"Therefore, natural resources are important at the stages of implement the ideas to create the products.",True,english
11,140781,A good nuclear reactor concept would be one which strikes a balance between cost and performance without compromising the safety aspects.,True,english
11,89616,"In addition, the elderly may encounter biasness against them.",True,english
11,85305,"Scientist believes that the answer lies within the cell itself, the DNA of the cell that causes them to differentiate.",True,english
11,67735,"Rita Zahara (2005), Channel NewsAsia, 15 April 2005.",True,english
11,141745,"One of the leading concept of generation IV reactor, Very-high-temperature reactors (VHTR), uses advanced technology to increase the efficiency of electricity generation by 50% (Butler, 2004).",True,english
11,74622,"The electric refrigerator has acondenserand motor to drive it, in contrast a gas refrigerator does not contain any mobile mechanical components that could breakdown, and hence would require less maintenance.",True,english
11,101353,"Butler, D. "" Nuclear power's new dawn.",True,english
11,144266,"And certainly, when implemented on its own, each policy presents its own sets of problems.",True,english
11,91194,"Second, technology is advancing rapidly and users are expected to constantly upgrade themselves to keep up with the pace.",True,english
11,22213,Aging : Concepts and Controversies (3rd ed.).,True,english
11,66788,"In conclusion, Singapore should open up to accept more challenges and failures especially for the younger generations of engineers.",True,english
11,46162,For the latter it is especially important for the public as they can have a place for leisure.,True,english
12,123197,"Nuclear power became one of their choices, since it is clean and efficient.",True,english
12,98422,"Nowadays many houses are equipped with intercom doorbell to help "" respond to visitors without having to rush or feel panicky "" (1), thus preventing them from falling.",True,english
12,18064,"This may lead to wide ranges of problems such as blackmailing, complication of crime investigation, duplication of identity, and in some cases, it can even be used as a political weapon.",True,english
12,155413,"Hence, it should be used appropriately to track people.",True,english
12,76472,"Although there are problems and obstacles, the development in engineering design for innovations is crucial and essential.",True,english
12,64792,There are a few alternate energy sources apart from fossil fuels.,True,english
12,151661,Some of the genetic diseases could be cured if it is detected early.,True,english
12,103158,A psychologist roped in to help the engineers may have been able to foresee this impending structural failure of the wheel and intervened before it was too late.,True,english
12,156032,"Its applications in child kidnapping, marathon races, security of a country and health care have brought great benefits to human beings.",True,english
12,32056,"Moreover, the younger generations will come under heavy pressure due to the disparity ratio support of the aged.",True,english
12,76217,"We know that no country is perfect, and no country can fully adhere to the Engineering Design Processes that Khandani has postulated in his article "" Engineering Design Processes "".",True,english
12,20471,This will help the elderly to understand the causes and effects of these health problems which encourage them to adopt a healthy lifestyle that reduces the risks of contracting these illnesses.,True,english
12,23205,Eldershield is designed for elderly who need long-term care or can not afford the expenses on severe disability.,True,english
12,121757,"Due to the previous terrorism attack at another airport, excessive planes were diverted to the Tenerife airport.",True,english
12,31389,It ensures the majority of the population finds employment and inflation stays under control.,True,english
13,141708,Massachusetts Institute of Technology (2003) The Future of Nuclear Power.,True,english
13,12441,This is due to the fact that genetic testing can reveal possible high-risk diseases the individual may develop.,True,english
13,81922,"By the end of 2009, the price for a gallon is expected to increase to about US $250.",True,english
13,141094,"Even today, six years after the Columbia accident, NASA still do not solve the falling foam problem (Young, 2006), and the officials still say there is no need for a heightened concern (Hays, 2009).",True,english
13,111682,How do we meet the power needs of the growing world with this limited power sources we have ?,True,english
13,70660,Healthcare is a basic essential in every country.,True,english
13,149242,"Culture, kinship and genes : towards cross-cultural genetics.",True,english
13,94507,"To a large extent, current research and development/policies have helped to ease the aging process.",True,english
13,155117,Radio Frequency Identification (RFID) and Privacy : Shopping into Surveillance.,True,english
13,50607,"Even though it is essential for the government to allocate public spending on the aged since the effects of the ageing population will impact the national economy and society, unlimited funding on the aged may have negative implications on the economy.",True,english
13,118260,We have confidence that it can bring great advantage to the world when technology is mature.,True,english
13,150857,So it is crucial to let the family members know the results so that they can receive treatment earlier.,True,english
13,76281,The value of'going by the book' may render us so accustomed to stick to the fail-safe solution we learn from textbooks we do not want to write books anymore.,True,english
13,147336,"Thus, they might become despondent in life.",True,english
14,140823,The VHTR is a better choice due to its capability to generate hydrogen gas which can be used as fuel and due to its excellent fail-safe concept which may prevent an adversity should it arise.,True,english
14,112263,"June 26) Very High Temperature Gas Cooled Reactor (VHTR) 10, 3 Retrieved Octobor, 2009, from ttp : //gif.inel.gov/roadmap/pdfs/p_grns_june_25-27_presentation_gp32-00.pdf",True,english
14,25714,The government should spread out its public spending to the various groups of people in need instead of just focusing on the elderly.,True,english
14,6439,The opportunity to test and implement meant that the surgical system was ready to start its race in addressing health concerns.,True,english
14,59955,"Social Sector wants Govt to Move Beyond Law for Parent Maintenance (2009, 19 August) Channel NewsAsia.",True,english
