batch index,sentence NUCLE ID,original_text,is perfect,original_language146,11834,Ethics of Genetic Testing : Medical Insurance and Genetic Discrimination.,True,english
146,64700,"We can define research technology as a technology based on deliberate examinations and careful analysis, and serendipitous technology as a technology found purely by luck.",True,english
146,129287,"It demands less space of repositories as it recovers and recycles 99.9% of the actinides and has the thermal efficiency of about 40% ("" GEN-4 : Technology : Systems "").",True,english
146,126992,"According to an article (The Journal of Urology, 2004), the cost of each surgery ranges from a few hundreds to a few thousands depending on what surgery is performed.",True,english
146,123454,"Obviously, the human factors occupy a large proportion.",True,english
146,21604,This shows that much more can be done to improve the different kinds of policies.,True,english
146,11531,Trends in Genetics : Grading the Gene Tests.,True,english
146,63496,"Hence, with lower incomes, they may not be able to afford the increasing healthcare services.",True,english
147,121699,Global warming has been linked to the more frequent occurrence of natural disasters.,True,english
147,3993,So he wanted to use the stove to dry the apron.,True,english
147,16793,"Thus, if the previous method was used, more people would be at risk of contracting the virus as it would take more time to identify and quarantine an infected person.",True,english
147,71296,The world may not run any more.,True,english
147,158630,One of them is implanting a RFID chip which contains the medical record of the patient in their body.,True,english
147,115787,The cost of this technology is high compared with traditional treatment.,True,english
147,38325,"Furthermore, some elderly advisory committees have been established in schools, communities, corporate, and government.",True,english
147,5211,The electric car is created as it does not pollute the air unlike gasoline vehicles.,True,english
147,8199,"For example, if no power supply company is willing to build charging stations for electric cars, it would be impossible for electric cars to exist.",True,english
147,73425,"However, all these companies do not do innovation design.",True,english
147,24408,"Dementia Research Centre, Queen Square, London, UK, (2008).",True,english
147,30703,"As such, the government has placed great emphasis on developing our education sector to ensure that the country maintains its global and regional competitiveness.",True,english
147,93950,Citizens would consider migration and foreign talents would be less attracted to migrate into the country.,True,english
148,113566,The fuel cycles employed also differ in the reactors of the three scales.,True,english
148,3710,Therefore Toshiba needs to consider all factors during their innovations.,True,english
148,76631,"In conclusion, companies and even individuals have economically and socially shaped electric refrigerators, making them a preferred product over technologically better gas refrigerators.",True,english
148,23278,"According to the United Nation's prediction, by 2050, 22% of the world's population of 9 billion will be over 60 (The Economist, 2009).",True,english
148,138831,"Last but not least, with the innovative design structure and modern materials, SFR therefore has lower power plant capital cost with higher effective productivity.",True,english
148,12966,It is important for individuals to share the results with their families in order to avoid diseases and benefit the whole family in the future.,True,english
148,151949,"This may result in family members responding negatively to the news and thus, straining the ties between the tested individual and his or her family members.",True,english
148,37348,"For example, Australia has implemented means-testing scheme for the Age pension.",True,english
148,112487,""" Hence, this idea of improving safety might not be feasible as it is going to be costly and its entertainment value will be affected.",True,english
148,5461,"For instance, Toshiba's corporate leaders denied Tetsuya Mizoguchi's request on the laptop project (Rogers, 2003).",True,english
148,108977,"Engineering is concerned with improving equipment from the point of view of mechanical and electrical design, whereas psychology is concerned with the mind and behavior (Stanton, 1996).",True,english
148,154068,"The usage of this technology has also brought about many controversies on privacy as a basic human right, the lack of control over who can view the information of those who are being tagged, and lastly, the psychological impact it has on the individual and the society.",True,english
148,12696,"However, with the knowledge of employees' genetic disorders, employers can better reduce the occurrence of work-related diseases.",True,english
148,49807,Thus public spending in science and technology can alleviate the rising cost of food which deals with the problem of the increasing population.,True,english
149,77794,"Thanks to the advancement of the manufacturing process and cheaper material, the price ($5000- $15000) of normal heart pacemakers is much more acceptable compared with that of those produced in early time.",True,english
149,153653,"Apart from the RFID tags, GPS can be applied to investigate the criminal activities such as murder cases, robbery and serious corruption (Michael and Rose, 2007).",True,english
149,86682,"Similarly, few people risk to make a change, most of them focus on the development of existing productions.",True,english
149,151983,Genetic testing helps cancer survivors fight for their loved ones.,True,english
149,93631,"Who knows, in the future we might even have a fully automated house with a built-in conveyer belt to guide the elderly from one point to another.",True,english
149,86056,"The steps named in order are identifying the problem, gathering of information pertaining to the problem, generating of solutions, analyzing and testing the solutions and implementing of the solution.",True,english
149,131867,"The subsequent series of action of the operators only made conditions worse, until the hydrogen exploded, consequent of the complete meltdown of the reactor (U.S.NRC, 2009).",True,english
149,74155,"When we look at these two technologies which were innovated differently we find that research based innovations are according to the famous proverb "" Necessity is the mother of invention "".",True,english
149,14114,"For example, as an alternative to incarceration, criminal suspects could opt to be electronically monitored in the outside world (How fair, n.d., para.",True,english
149,123182,The surgeon may never have to touch his patient.,True,english
149,5568,"As resources consumption increases rapidly and they are limited, there are fewer resources for people to use.",True,english
149,155036,The word'Surveillance' originally came from France where it means'to watch over' in French.,True,english
149,92315,The government has also stepped in by introducing various policies to suit the needs of the aging population.,True,english
149,40003,AARP-COUNCIL FOR THIRD AGE CONFERENCE : REINVENTING RETIREMENT ASIA.,True,english
149,89482,"Due to the growth in the awareness of the different financial needs over an individual's life cycle, financial institutions have designed and introduced a wide range of products to meet these needs.",True,english
150,85937,It has to be created to fulfil the world's need nowadays so that our future generation has a healthier earth to live in.,True,english
150,138699,DOE Nuclear Energy Research Advisory Committee and the Generation IV International Forum.,True,english
150,134674,The experience minimizes the chances of any experimental failure and in turn saves the research funds.,True,english
150,88831,"If the government can give out the pensions according to the financial need, the amount of money spent on the elderly will not climb rapidly even if the aging population increases at an incredible speed.",True,english
150,149387,"Conversely, some people feel that it is an invasion of privacy (Tanner, 2004) and that others may abuse the information (Ostrom, 1997).",True,english
150,112719,"Hence, safety should not be an issue with modern nuclear technology.",True,english
150,6528,That is to say that the exchange of information is very important for innovation.,True,english
150,134387,"However, wastes emitted by coal powered plants are essentially more radioactive than wastes produced by nuclear power plants (Mara Hvistendahl, 2007).",True,english
150,26409,One such effort is to make commuting more convenient for the aged and wheelchair-bound through the introduction of Wheelchair Accessible Buses.,True,english
150,49341,"This concern has been expressed by some Singaporeans over the gathering of foreign workers in certain parts of the city on weekends, particularly where these places are at or near residential areas.",True,english
150,124474,"There are some barriers that may prevent nuclear energy from developing : it is expensive to build a plant, there may be human errors and it still produces radio-active wastes.",True,english
150,24008,"The plan is for all our public housing estates to be barrier-free by 2011 (Yap, 2009).",True,english
150,31778,"Majority of the public spending should be directed to areas that can assist in the country's developments such as the improving of the education system and creating of more job opportunities, so substantially, lesser public spending on the aged should be set aside.",True,english
150,31192,"In addition, the people who belong to the working class are not the ones who are most vulnerable to the economic crisis.",True,english
151,47582,"As people age, their functionality depreciate in terms of physical and mental ability.",True,english
151,86146,"There lie two major hurdles, the small population size and the lack of natural resources, to engineering design process in Singapore.",True,english
151,144223,"In such a case, these savings can then be used appropriately, especially after retirement.",True,english
151,74710,"Human need is something that is necessary for humans to live a healthy, convenient and comfortable life.",True,english
151,146474,"Initially, upon receiving the test results, individuals might exhibit a multitude of reactions ranging from depression to anxiety to anger (Cancer.net Editorial Board, 2009).",True,english
151,46663,This is to ensure that the elderly and the working people will not over rely on the government for aids.,True,english
151,115870,Pediatric Robot Surgery with the Da Vinci Surgical System.,True,english
151,30427,This places an increased strain on the budget.,True,english
151,6398,"Information, being a liabilty, will first have to be sourced out and then scrutinized to the minute details.",True,english
151,141629,Safety issues and costs are the main reasons for the public to oppose the usage of VHTR.,True,english
151,125464,Nuclear Vision's at the Idaho National Lab.,True,english
151,50207,"With effective social policy, it will help to slow down the aging process.",True,english
151,8276,"In relation to the safety aspect, it is through such synthesis that safety will always be improving because better solutions to safety problems are generated.",True,english
151,101277,They claim that nuclear power is uneconomical.,True,english
152,146412,"However, should such important information that may potentially save the lives of one's relatives be withheld due to these personal benefits ?",True,english
152,81007,"After years of innovations and experiments, the stove nowadays is safer to use and more convenient.",True,english
152,36442,"In conclusion, public spending for the aged must be capped.",True,english
152,140116,"Secondly, as I mentioned above, the steam has the same density and can be mixed with the liquid, so that the whole moderator have the nearly same density everywhere.",True,english
152,63319,"However, the money used can be better utilized to develop other areas.",True,english
152,142507,"However, nuclear energy is in fact one of the least expensive energy sources.",True,english
152,41853,Singapore's CPF Retirement Scheme : Delivering More Bang for the Buck.,True,english
152,139653,"However, it is known that for VHTR, such waste will stay in the atmosphere for a few decades compared to the norm of about a millennium.",True,english
152,122951,"China, Canada, France, Japan, Euratom and the USA have already signed on the System Agreement for the VHTR under the Framework Agreement (GIF Annual Report 2008).The total budget for the research and development of the Generation 4 reactors is estimated to be 6 Billion USD according to a GreenPeace report of 2005 (Butler,2004).",True,english
152,37224,Children of the aged should be responsible for their own parents.,True,english
152,114380,"In addition, the focus of the Gen IV reactor concepts is on the use of inherent safety features and designs.",True,english
152,50323,"The tourism industry posted high revenue of S $14.8 billion in 2008, a 4.8% increase from 2007.",True,english
152,115878,"While the demand of energy is constantly increasing, earth is running low in coal, oil, and gas supply.",True,english
152,112245,"Optimistically, by about 2020, the first commercial VHTR would be in operation.",True,english
152,74985,"Although some countries are still keeping up with the rapid increasing of energy demands, there is still a need for other alternatives to prepare for the future.",True,english
153,100323,1) Population and demography key indicator 2008,True,english
153,156459,"Through video and satellite surveillance, polices can track the movement of dangerous criminals and terrorists.",True,english
153,16359,"In conclusion, the use of surveillance technology to track people should not be banned.",True,english
153,83332,The birth rate in Singapore is not able to support the uprising ageing population.,True,english
153,36314,Therefore the government should not limit public spending on the aged as these effects are long-term and permanent to a country's development.,True,english
153,127433,"With the exponential increase in energy consumption, nuclear energy will prove to be a good alternative, or even a primary source of energy.",True,english
153,6629,"In the vats there is liquid nitrogen, but samples are perched above 20 centimeters of it to let the vapor, instead of the liquid itself cool and preserve the genetic information.",True,english
153,44705,"As the society is facing an aging population problem, the retirement age would increase.",True,english
153,110757,"Currently, nuclear industry is generating 17% of the world's electricity.",True,english
153,36512,"With all these concurrent efforts by BCA, mobility has improved vastly for the elderly.",True,english
153,63463,Some may argue that public spending on the aged should be limited so that it will not limit the country's development.,True,english
153,44677,"As people work longer, the amount of wealth generated would be greater.",True,english
153,105026,What will happen during the rainy seasons and will there be enough solar energy to sustain our daily usage ?,True,english
153,116404,"He pointed out that psychology is crucial to engineering process, especially to highly complex socio-technical systems with high risks, since the application of psychology can reduce the risk and prevent accidents from happening.",True,english
154,36691,"Hence, in the developed European nations and Singapore alike, the authorities do build walkways which do not have sharp edges which make it difficult for wheelchair users to mount.",True,english
154,58334,There are those who are without any dependants and savings to see them through their retirement years.,True,english
154,2341,"Since the right of inventors and innovators is not well-protected, people are unwilling to create new products.",True,english
154,41072,"Lastly, an ageing population places pressure on the entire nation and everyone should play a part to take care of the aged.",True,english
154,78505,"In September 1928, having returned from his vacation, Fleming continued with the work in his lab immediately.",True,english
154,157184,"In fact, every RFID tag is assigned a unique serial number.",True,english
154,122534,The generation of Hydrogen brings about two improvements of the reactors.,True,english
154,110326,"In other reactor designs, either the plant or the reactors will be automatically shut down.",True,english
154,135254,"The alternative way to generate electricity is the use of nuclear technology according to Butler,D.",True,english
154,114907,"But the fact is that the VHTR uses a graphite-moderated core with specific design optimizations (Sterbentz, 2007).",True,english
154,118734,"Bulletin of the Canadian Nuclear Society, Vol.",True,english
154,37064,"Furthermore, the money that is spent on the aged ultimately comes from the pocket of the working population.",True,english
154,6085,Conventional research involves a lot of management procedures.,True,english
154,111085,Collecting Human-Factors Data From Accidents and Incidents.,True,english
155,110348,"Also, the people working in the power station should not be placed under danger",True,english
155,65957,"Furthermore the young generation is well informed and is taking several initiatives to rectify the previously committed mistakes, thus causing the country to accelerate in a path of new economic revelations.",True,english
155,27552,This can be seen as a step forward to what we want to achieve.,True,english
155,143546,The government will extend more loans to local companies and spend $600 million over the next two years on training workers.,True,english
155,96823,"This essay will discuss the impact of some of these technological inventions and how it helps the aging population cope with their decline performance, productivity and health.",True,english
155,27184,The Act is proposed with the assumption that some children selfishly abandon their parents.,True,english
155,127665,"However, each year, many people all over the world die from respiratory diseases because of the burning of coal, gas, oil, etc.",True,english
155,137316,"The current alternative energy sources include solar, wind, nuclear, and biomass.",True,english
155,75672,"Due to the global economic crisis, currently Malaysia is under economic downturn.",True,english
155,81989,An influenza virus is able to infect a host cell due to the presence of neuraminidase.,True,english
155,140963,It is estimated that electricity demand will have doubled by 2030.,True,english
155,129123,"21st Science and technology, Fall-winter, 36- 37.",True,english
155,300,We must also value-add the product to make it even more attractive.,True,english
155,76994,"Even if consumers do not go for pirated products, they will still go for second hand products.",True,english
155,70570,Humans need to travel from one place to another easily.,True,english
156,122323,This would lessen the possibilities for power shortage accidents to occur.,True,english
156,112027,Waste treatment plans are also in place to tackle the lingering problem of long-live radioactive waste.,True,english
156,389,"Next, we have to gather relevant information about the problem so that we are able to ensure that the solution we are looking for is able to solve the problem directly.",True,english
156,724,"For example, in my hometown Harbin, the government decided to develop an underground traffic system.",True,english
156,47488,Some economists believe that the government should cut down public spending on the aged to invest in other areas while some completely disagree.,True,english
156,118226,"In their view, under such a high temperature, the reaction should be harder to control and thus more dangerous.",True,english
156,94448,"After all, it is their parents who took care of them when they were young.",True,english
156,46813,We can tell by the incline in the economy that has taken off over the past few years.,True,english
156,154892,"In conclusion, as useful as surveillance technologies such as RFID may be, unless prior permission is given by the individual, they should not be used to track people as it is considered a breach of privacy.",True,english
156,140525,VHTR is likely to be the most advanced concept in terms of practical experience as Japan already operating a similar high temperature reactor at Oarai.,True,english
156,135538,"Not many people died that day but thousands of people were exposed to radiation that caused them to suffer severe health problems (BBC News, 2000).",True,english
156,80113,"Similarly, after penicillin was widely used by doctors, millions of people were saved by it.",True,english
156,38315,"Along with the development of technology, it's often questioned that the knowledge an elderly has is out-of-date, and may no longer be suitable in today's workplace.",True,english
156,38243,"Hence, elder dependency could be reduced when the elder can support themselves for their own daily expense.",True,english
156,111839,"5.Delft University of Technology (2006, December 12).",True,english
157,112201,"Besides generating energy, the energy generated from nuclear reaction can also be used in crude oil refining or metal production (Ogawa, & VonLensa, 2002.).",True,english
157,9950,"Within a few years, there were more postings and news groups than the system could handle.",True,english
157,99865,It is caused by declining fertility and rising life expectancy.,True,english
157,1870,"A multi-user online environment was created, allowing a large group of people to get connected at the same time.",True,english
157,83707,"No matter when and where it is, one can get money by credit card instead of carrying a lot of cash.",True,english
157,55892,"For countries such as Singapore where labor is vital and is the only resource, spending on education is important for the future growth of the country.",True,english
157,153777,"Secondly, surveillance technology poses a risk to personal privacy and healthcare.",True,english
157,154411,Cameras are usually used in high security or restricted access workplaces to protect these places.,True,english
157,77223,I believe the current human need that should be given priority is the need to reduce traffic congestion as it has always been a problem left unresolved for many decades.,True,english
157,154064,"It helps to "" identify, monitor and track movements and data.",True,english
157,147949,"When family members are aware of the truth, at risk family members can be notified early and others can provide support for the carrier to overcome the difficulties he will be facing in the fight against his disorder.",True,english
157,77525,It is almost the same for the team working in skunkworks environment.,True,english
157,123986,"All these will make the VHTR more competitive in the fierce competition of today's energy market (Renkai, 2000).",True,english
157,42253,It has already been carried out in the northern and western parts of Singapore.,True,english
157,152577,"There are those who feel that an individual of a known genetic risk should not be obligated to inform his/her relatives as genetic results is private and of high confidentiality (HOPES, 2002).",True,english
158,137497,"There are concerns about producing nuclear energy with regards to its cost, security and performance.",True,english
158,93743,"For example, if money is diverted to the child benefits scheme, this will improve the situation of low birth rates but does not relieve the need for elderly assistance.",True,english
158,128018,"As every design process involves more than one engineer, some people might argue that this accident occurred due to poor team work and effort.",True,english
158,157379,CCTV's and RIFD (radio-frequency identification) are some examples of surveillance technology.,True,english
158,16615,"Firstly, every human's gene is unique and personal.",True,english
158,17236,Three important points can be raised to support this stand.,True,english
158,101459,"First, nuclear reactors operate using cheaper nuclear fuel that accounts for only 27% of the variable costs of a kilowatt-hour.",True,english
158,46969,They require the highest amount of attention and care.,True,english
158,63489,"In the future, this problem may worsen.",True,english
158,86975,"The big profit made by the patent was used to support other research projects of Madison professors, provide financial aid to doctoral students and cover other research expenses.",True,english
158,138521,"Static and kinetic friction depends greatly on its coefficient, which usually ranges from 0.5 to 1.5.",True,english
158,7786,In the article'Electric cars : On the road to greener transport ?,True,english
158,47776,"Thus, there is a need for other policies in order to protect this vulnerable group of elderly.",True,english
158,64743,"However, regardless of that fact, both technologies serve an ultimate purpose to provide a much better, easier, and safer environment for Man to work in.",True,english
159,18623,"However, the physician is present to provide advice and post-test counselling.",True,english
159,47878,"Thus, more funds have to be set aside to lessen the strains on the people caused by the increasing costs of basic necessities.",True,english
159,5127,"When it comes to the DNA's structure, the situation was quite different.",True,english
159,35479,Any small disease can be much more fatal to the elderly.,True,english
159,98959,"Also, as we grow in to adulthood, many things start to change in our life.",True,english
