batch index,sentence NUCLE ID,original_text,is perfect,original_language211,155546,"Prison violence was reduced by up to 60% in some United States prisons that had RFID installed (Kanellos, 2004).",True,english
211,20533,"Public spending on the aged should be limited as there are other areas that are of equal, or even greater, importance.",True,english
211,22377,"In conclusion, caring for the elderly is only right and necessary.",True,english
211,115607,A human scientist can assist them and improve the system.,True,english
211,6199,"According to National Geographic (August, 2009), the'Big Idea' is to launch millions of reflective particles or tiny'sun shades' into space (between the Earth and the Sun).",True,english
211,110271,"Nature, 429, 238-240 Hejzlar, P., Pope, M.J., Williams, W.C. & Driscoll, M.J. (2005).",True,english
212,150024,"If a genetic disorder runs in my family, what are the chances that my children will have the condition ?.",True,english
212,31062,"Reference BIBLIOGRAPHY \ l 1033 Peterson, P. (2001).",True,english
212,40514,""" There are also many countries that encourage individual responsibility such as Japan.",True,english
212,25739,Singapore sees terrorism as one of the biggest threats to its security and economy.,True,english
212,60313,"Singapore's social security system starts to creak, Financial Times.",True,english
212,140036,"However, we all know that this can not be true.",True,english
212,47021,This is to prevent the common misconception that the elderly can rely on the government to support them during old age.,True,english
212,89496,"With longer working life, people will be able to accumulate more wealth which they can use to support themselves in their old age.",True,english
212,76549,The crop designed must be low cost so that even farmers living in poverty can also afford to buy the seeds of the crop.,True,english
212,21889,"Robert B. Friedland and Laura Summer, Demography Is Not Destiny, Revisited.",True,english
212,73857,"New technology could increase the variety of food capable of being genetically modified, replace existing gene modification methods with cheaper alternatives and even allow vast improvements on food yield from current processes.",True,english
212,42228,"In response, Singapore has devised strategies to cushion the impact.",True,english
212,49731,"Meanwhile, it might be recognized that public spending on the aged should be encouraged as a charity activity instead of being mandatory.",True,english
212,94038,It is believed that it will increase until 65 percent in the next three years.,True,english
213,48726,"Besides, some older workers still keep them up to date and learn new things.",True,english
213,143623,Singapore's only and main resource is her population.,True,english
213,77101,"Secondly, some social reasons also exert detrimental influence upon the designing and innovating process in China.",True,english
213,135545,"However, there are ways to reduce the possibility of this human-caused accident.",True,english
213,43673,""" In Singapore : Government squanders savings.",True,english
213,113083,"Carl B. and Mark H. (2005, Feb 4).",True,english
213,98311,An old woman in this survey said it is not very convenient for her to use the wheelchair at home and her eyes feel tired very often.,True,english
213,114503,"If technology could help to automate the reactors, then the number of operators required will be reduced and by doing R&D, the parts could have a longer lifespan and hence expenditure of replacing parts will be much lowered.",True,english
213,142009,It seems that nuclear energy points to the way to meet future energy demands without destroying the environment.,True,english
213,157564,Informed consent : ethical considerations of RFID.,True,english
213,36985,"With this physical and psychological health, people have a tendency to lengthen their life span.",True,english
213,126326,"Therefore, there is a possibility that the use of psychology would have prevented the accident.",True,english
213,142954,"Jim Green writes in Nuclear Weapons and'Fourth Generation' Reactors : "" Nuclear power could at most make a modest contribution to climate change abatement, mainly because it is used almost exclusively for electricity generation which accounts for about one-quarter of global greenhouse emissions.",True,english
213,75194,The Report on the Development of Chinese Talents (No.3).,True,english
213,24934,"Hence, the grown children should appreciate their upbringing and take good care of them in return.",True,english
214,81891,Environmental problems surrounding car production and usage are becoming an increasing threat to our world today.,True,english
214,123864,The form of the energy generation is the most efficient.,True,english
214,83675,So the credit card can solve the instant shortage of money.,True,english
214,138248,"In addition, VHTR is capable of producing hydrogen gas by breaking the molecular bond of H2O.",True,english
214,78870,"In the past, photos could only be printed on paper, which confined the sharing of photos.",True,english
214,75041,"In developing countries, education is even a far-away concept though a lot of governments' and outside donors' have been made.",True,english
214,122979,Nuclear power promises a viable source of energy which is far cleaner and more cost effective than conventional thermal power stations.,True,english
214,143472,Critics doubts the profit of the billions of investment.,True,english
214,41841,Solvay Pharmaceuticals AMAC (Asia - Middle East - Australia Canada).,True,english
214,84800,"Finally, the last step will be testing and implementing the solution to the design problem.",True,english
214,78642,"Additionally, companies should import the advanced ideas and skills from the developed world to improve the technological skill of themselves.",True,english
214,58409,"Canada has experienced the highest per capita immigration rate in the world and expects an increase of 23.1% of population growth over a period of 25 years (Wikipedia, 2009).",True,english
214,12358,Many hospitals implant RFID in patients to track their health condition timely by nurses.,True,english
214,140089,"Actually, for the supercritical water reactor, it is not correct.",True,english
214,120926,"In short, the Molten Salt Reactor system is safe to operate and friendly to the environment.",True,english
215,119184,Some people claim that Gen II and Gen III reactors are safe enough for operation.,True,english
215,158743,Surveillance technology can help to increase work efficiency.,True,english
215,126871,"Jack, S. and Nicolas, L. (June 18, 2008).",True,english
215,98453,"In America, a survey has been conducted by the Kaiser Family Foundation to find that one third of seniors above 60 and two-thirds of people between 50 and 64 get access to the Internet.",True,english
215,93784,"Instead, it should be limited that everyone must n't have any priorities when they get treatment for any kinds of illness that are resulted from unhealthy lifestyles.",True,english
215,32900,"Every government should see it as their responsibility to create and sustain a society where their citizens, in particular the youth, can secure a livelihood and build a future (Thalif Deen, 2006).",True,english
215,140114,"The supercritical water is also used in different areas for a long time, so that the supercritical water reactor can be a practical innovation and it is very safe.",True,english
215,144146,"An extension in the working lives of the elderly, can bring negative effects.",True,english
215,86960,The hard tomato program and the discovery of Warfarin started differently.,True,english
215,10727,"BIBLIOGRAPHY \ l 1033 Gruening, K. (Spring 1995).",True,english
215,110385,Applying the use of psychology in the engineering design processes may make it more costly and slow it down.,True,english
215,157794,"Thus, the privacy of the employees is being invaded when RFID is used for tracking purposes including tracking someone going to the toilet.",True,english
216,49386,"United Nations Educational, Scientific and Cultural Organisation.",True,english
216,137995,"The new reactor would be able to produce 50% more energy with the same amount of fuel (Butler, 2004).",True,english
216,76010,"The complication in the official procedure causes the hesitance of investors, and it subsequently affects the development of design process and innovations of engineers, who need investment to execute their projects.",True,english
216,27825,"Besides, the government also encourages its citizens to work as long as possible and contribute to the CPF to have a good preparation and more financial security in old age.",True,english
216,124693,It is thus important for us to consider whether nuclear power plants are environmental friendly.,True,english
216,83005,"As laptop is created for the convenience of the customers, both Mac laptop and Toshiba laptop are similar in their portability.",True,english
216,31823,It is impossible to support them in the long- run as there are many other areas of concerns which the government needs to look into as well.,True,english
216,21295,The government needs to know how to set limits on the healthcare budget for the elderly.,True,english
216,83182,"Therefore, an innovation will only become a product, if factors such as economic, government support and usability of the product supports the development of the innovation.",True,english
216,100893,"What is more, studies (Wells & Ryan, 1991) show that 65% of the major engineering accidents are directly caused by the mistakes made by human beings.",True,english
216,138803,Some people think that a nuclear power plant is expensive to build due to the advanced technology and the quality of the structures it requires.,True,english
216,33568,"In other words, public spending on the aged should be limited to a certain extent as the money can be distributed to other aspects of development.",True,english
216,65736,Hydrogen fuel cell cars must have a practical way of emitting water as its waste.,True,english
216,122588,"However, we can not discontinue the research on the VHTR just because it is dangerous.",True,english
216,33676,This could be in the form of less illness associated with old age and more activities available for older ones to participate in.,True,english
217,144209,"This gives the elderly an opportunity to work to supplement his/her own expenses, and it also helps in raising the productivity of the workforce as well.",True,english
217,24304,"In the year 2000, Singapore has 7.2% of its population aged 65 and above.",True,english
217,20507,"With economical growth, the standard of living will also increase for people living in Singapore.",True,english
217,57833,This ensures that the family is still able to sustain themselves financially in the event that the contributor is unable to provide for the family.,True,english
217,62141,"In the case of Singapore, PM Lee spoke on the National Day Rally 2009 about the need to restructure the health-care system to serve more elderly patients.",True,english
217,19679,"35000 new jobs will be created and expected to bring in an estimated 1.5 billion annual boost for GDP in the country (May 27, 2006 Newspaper).",True,english
217,145233,"However, taking care of the elderly should not be the sole responsibility of the government.",True,english
217,156848,"RFID can be deciphered from afar and they contain more information than barcodes (Free, 2007).",True,english
217,103037,This is proven from its low excess reactivity to decreasing maintenance costs.,True,english
217,2738,Why Should You Be Concerned About Air Pollution ?,True,english
217,138910,The purpose of THERP is to evaluate the probability of a human'error' taking place throughout the completion of a job.,True,english
217,4905,"Although progress has been impressive by almost any standards : economy, education, health service..., Vietnam must face a lot of current challenges, especially in technology.",True,english
217,130448,"With the promising results the studies have shown, it is safe to deduce that in the future we shall see a row of haptic chairs for the hearing impaired in concert halls.",True,english
218,72798,"In the 21st century when people around the world get more opportunities to interact with each other, the ability to speak and understand other languages has become more and more important.",True,english
218,133708,"According to Wiley (ScienceDaily, 2009), if the surgeon is well trained, using robots could help him perform many surgical tasks without other human assistants.",True,english
218,145936,"Hence, with the governments' efforts to implement laws to protect individuals' interests, they should feel assured of their privacy.",True,english
218,80724,Soon he found the note useful as it was able to be attached to other documents without leaving any adhesive marks.,True,english
218,147921,Ethics of Genetic Testing : Medical Insurance and Genetic Discrimination.,True,english
218,132707,"Secondly, detractors argue that consumers would prefer to use other forms of energy due to their cost competitiveness.",True,english
218,75411,"In short, engineers should adopt the green mark scheme for all the buildings they design in the future to reduce the environmental impacts that are harmful to the earth.",True,english
218,65213,"According to Roger, serendipity is the accidental discovery of a new idea.",True,english
218,132700,Could it be that the twin reactors were more difficult to hit or the terrorists knew that the twin reactors were well protected or prepared to handle terrorists attacks ?,True,english
218,97449,Now fiscal policy to help the aged does not satisfy everybody's needs.,True,english
218,142566,One example of a developing country is Kosovo in southeast Europe sharing borders with Serbia and Macedonia.,True,english
219,24685,"Meanwhile, the cost burden of providing for the elderly can be spread over a larger future generation.",True,english
219,118945,"This is because, comparing the amount of fuel cars owned, to the amount of electric cars owned, electric cars are very low amount in ratio.",True,english
219,63261,"Vaclav Smil, University of Manitoba, Canada, The Unprecedented Shift in Japan's Population : Numbers, Age, and Prospects.The Asia-Pacific Journal : Japan focus.",True,english
219,84777,"With the Earth at its critical state, a "" greener "" car is of the essence, and engineering design processes can guide us to our goal.",True,english
219,86316,Only the customers' demand can stimulate the enhancement of the car industry.,True,english
219,86992,"All of these included building a prototype of the machine used to pick the tomatoes, contacting producers who were willing to sell their products, making their research results known to the local farmers and collecting their feedbacks to improve.",True,english
219,151890,The advent of genetic testing has created a scientific breakthrough in identifying risk factors for disease.,True,english
219,18481,Genetic testing is generally used to test for any diseases that arise due to gene mutation.,True,english
219,101254,""" par.3) This has instilled a lot of fear in the citizens and they have no confidence in the security of the plants.",True,english
219,143416,"Nuclear Power Engineering and Technology, 2002, issue 2.",True,english
219,156124,"Hence, this labor-saving technology should be utilized optimally as it is capable of bringing numerous benefits and conveniences to the society.",True,english
219,5356,What is hampering engineering design process for innovations in China ?,True,english
219,86592,It is necessary to recognize that the entire process is fraught with numerous difficulties which could impede an engineer's creativity.,True,english
220,96835,"Although it might take an older person a longer time to learn, the cognitive function does not decline with age.",True,english
220,28967,""" That's why fitness facilities, children's playground and elderly exercise equipment are put together "" quoted Mr Mah BT (2008) in a housing speech.",True,english
220,88979,Caring for health of the aging population will pose a problem for the government.,True,english
220,48070,"According to Mr Lee Hsien Loong, Prime Minister of Singapore, our median age today is 36 and the life expectancy is 80 years.",True,english
220,49755,"The elderly people could be a huge expense on the national budget, while there are other significant sectors demanding for more concern from the entire society, In spite of partly against moral aspects, the country's interest might outweighs the filial obligations.",True,english
220,110700,Cost and security are the two main reasons for opposition to nuclear power technology in many countries.,True,english
220,96971,Daily expenses and medical needs might become a burden for them.,True,english
220,151979,"Babowice, H. (2008 03 March) Breast cancer curable if treated early enough, doctor says.",True,english
220,86280,It should focus more on practical applications rather than theory.,True,english
220,142176,"Chen, J., Hoffelner, W., Pouchon, M., Degueldre, C. (n.d.).",True,english
220,40158,"Clark, R. L., Ogawa N., & Mason A., (Eds.).",True,english
220,113689,The water channels run through the core vertically where a temperature gradient will be built up.,True,english
220,55571,They not only struggle to balance the social needs and interests of different demographic groups but also to sustain economic growth.,True,english
220,77824,"According to Khandani, the process of solving design problems can be generalized to five steps : "" define the problem, gather pertinent information, generate multiple solutions, analyze and select a solution, and test and implement the solution "".",True,english
221,152031,"Though families will be distraught by the results, accepting the fact and supporting each other in the course might lead to a stronger relationship within the family.",True,english
221,38227,"Parents have brought their children up, and in return the children will have the responsibilities to take care of parents when they get old.",True,english
221,101418,"Furthermore, developing countries that have insufficient funds to build nuclear reactors can seek assistance from Alternate Energy Holdings (AEHI) that has offered to provide skills and funding in constructing nuclear reactors (AEHI, 2007).",True,english
221,28391,"As the aging population in Singapore increases, more and more money have to be allocated to the aging population.",True,english
221,152181,"Goh, D. (2003, Nov) Paediatric Shared Care Programme.",True,english
221,73815,This problem is very serious in many Third World countries in Africa as well as Asia.,True,english
221,46985,"The government should always measure the economic and social benefits and costs before implementing any policies, and implement those with the highest benefits.",True,english
221,43575,"However, the argument is that there can not be unlimited public spending directly targeted at the aged because there are other major concerns with the economy and society that the government of Singapore has to deal with.",True,english
221,30256,This has led to countries diverting some of the government revenues for the elderly.,True,english
221,69120,"In this way, they set criteria for evaluating plans.",True,english
221,40863,"In conclusion, less of China's wealth should be spent on the aged so that money can be diverted to other areas of the country's development.",True,english
221,45623,"After all, what can a group of healthy, well taken care of senior citizens bring to the country ?",True,english
221,152244,"Meanwhile, this disastrous accident may be prevented if the relative is informed of the result by the carrier.",True,english
221,122850,It is indeed quite expensive to build such a reactor but we can not look down upon the benefit that we will get after the reactor works.,True,english
221,119537,There are three important reasons for my stand.,True,english
222,118405,"Arguers may say that no matter how good the preparation was, there were still some unpredictable factors that might lead the mission to failure.",True,english
222,112185,This function ensures VHTR is very safe under attacks.,True,english
222,119341,"It is deemed to be much cleaner, greener and more effective than traditional fossil fuels.",True,english
222,64739,"Plunkett's accidental finding only occurred when he was testing the chemical reactions of gaseous tetrafluoroethylene (TFE) (Roberta Barbalace, 2006).",True,english
222,33496,Furthermore he also mentioned that our country needs to find new sectors such as the life science field to invest upon so as to keep the economy competitive.,True,english
222,61065,Old age not a thorny issue for her.,True,english
222,133306,"DOE Nuclear Energy Research Advisory Committee and the Generation IV international Forum, 2002, p. 49).",True,english
222,112526,Therefore the bottom line is safety only can be slightly enhanced by an improved design and itt depends more on the self discipline of the gamers.,True,english
222,10571,"However, the implementation of hands-on learning is only carried out to a small extent.",True,english
222,14381,"The use of RFID to track criminals will improve the safety and security within a prison and ultimately, improve the overall national security.",True,english
222,145681,"In my view, a carrier should tell his or her relatives about the result as firstly, there is a possibility that they might get the disease or they might be a carrier too and hence they have a right to know.",True,english
222,101798,We speculate that the demand for energy in future will be greatly increasing for future development.,True,english
222,110255,"With consideration of the current worldwide energy shortage, population expansion and global warming, it is appealing to bring about the generation IV nuclear power supply using GFR concept for its tremendous energy output and zero carbon emission.",True,english
223,138418,VHTR could even generate hydrogen at the same time under its high temperature.,True,english
223,72233,That is why the electric cars came into being.,True,english
223,16773,This method is highly efficient compared to traditional passport controls and surveillance methods.,True,english
223,24607,They may be asset-rich but many are cash poor.,True,english
223,44692,This can be achieved by sourcing foreign talents from other counties to immigrate to Singapore to contribute to our labour force.,True,english
223,97740,"By tapping on the large number of elderly, the country's workforce will be increased and more people will be available to drive the country's economy to encourage growth.",True,english
223,156319,"However, this has also caused a controversy where some argued that surveillance technology has invaded their privacy to a very large extent.",True,english
223,155121,"Knepper, P., Doak, J., & Shapland, J.",True,english
223,156366,Thus surveillance technology has become a necessity rather than a burden as we can not do without it.,True,english
223,147973,"In conclusion, the individual requesting genetic testing should be obligated to make known the results to relevant third parties for the benefits of both the carrier and the people around him.",True,english
223,141929,"This kind of material can absorb radiation produced by the plutonium, so that the radiation will be greatly reduced.",True,english
223,97278,Preparing for an Aging Population - The Singapore Experience.,True,english
223,3207,"Before applying this powerful technology for energy or military use, safety matters must be taken into consideration.",True,english
224,17438,"Critics may cite the flaws of the system in the case of Mas Selmat a member of the regional Islamic group called the Jemaah Islamiyah (JI), who successfully escaped to Malaysia.",True,english
224,140835,"Moore Patrick (2006, April 16), Going nuclear : a green makes the case.",True,english
224,143188,It would not only enhance the efficiency but also raise the thermal margin under transient condition.,True,english
224,104838,"The heat and high amount of electricity generated by the molten salt reactor, on the other hand, can be said to be constant and can be further tapped into for the production of hydrogen (Duffery, 2005).",True,english
224,42214,An Ageing Population Calls for Restructure of Healthcare System.,True,english
224,131578,"Substantiably, new power plants can not thoroughly solve unemployment.",True,english
224,98152,They are also more durable and stronger.,True,english
224,74682,"When such things happen again and again, people will have no desire to innovate because they know they will not succeed.",True,english
224,143094,"Nuclear power should be pursued, in recent years there is a leap in nuclear technology.",True,english
224,141507,Nuclear power will most probably be our main source of electricity generators once coal and fuel runs out.,True,english
224,140655,There are new generations IV reactors which are proposed to provide better output and safer mechanism in operating them.,True,english
224,80677,"Often, inventors who use their engineering talents to come up with innovative products fail to secure funding.",True,english
224,129915,How long till the light goes out.,True,english
224,19296,"People would go to the doctor for even the smallest discomfort, causing doctors to waste time on non critical care and forsaking those that need immediate attention (Messerli, 2009).",True,english
225,42306,"Thus, these two policies have helped to ease the aging process by cushioning the impact on the economy.",True,english
